video_id,title,description,published_at,channel_id,channel_title,category_id,tags,duration,definition,caption,view_count,like_count,dislike_count,favorite_count,comment_count
B783S7tAPOY,"Selena Gomez, benny blanco - Younger And Hotter Than Me (Official Music Video)","Listen to the new album “I Said I Love You First”, out now: https://sgxbb.lnk.to/ISaidILoveYouFirst

Shop new merch: https://selenagomez.lnk.to/store 
Join Selena’s mailing list: https://selenagomez.lnk.to/SignUp
Join benny’s mailing list: https://bennyblanco.lnk.to/SignUp

Directed by Jake Schreier

Follow Selena Gomez: 
Instagram: https://selenagomez.lnk.to/Instagram
Twitter: https://selenagomez.lnk.to/Twitter
Facebook: https://selenagomez.lnk.to/Facebook
TikTok: https://selenagomez.lnk.to/TikTok
YouTube: https://selenagomez.lnk.to/YouTube

Follow benny blanco: 
Instagram: https://bennyblanco.lnk.to/Instagram
Twitter: https://bennyblanco.lnk.to/Twitter
Facebook: https://bennyblanco.lnk.to/Facebook
TikTok: https://bennyblanco.lnk.to/TikTok
YouTube: https://bennyblanco.lnk.to/YouTube

Lyrics: 

Waited outside your apartment
You used to come down for me
I used to feel like an angel
Now I’m a dog on your leash
Begging for more

X on my hand drawn in sharpie
Now I use my own id
All of the girls at this party
Are younger and hotter than me
And I hate what I wore
But I hate myself more

For thinking you were different
Wish I never loved you
We’re not getting any younger
But your girlfriends seem to

Looking for something to tell you
Looking for reasons to speak
Pictures of you at the movies
Is she younger and hotter than me?
Is it all in my head?
Should have moved on instead

For thinking you were different
Wish I never loved you
We’re not getting any younger
But your girlfriends seem to

Someone else
Was I just someone else?
now you’re someone else
Someone else

Waited outside your apartment
You used to come down for me

#SelenaGomez #bennyblanco #YoungerandHotterThanMe #ISaidILoveYouFirst

Music video by Selena Gomez, benny blanco performing Younger And Hotter Than Me.© 2025 SMG Music LLC & Friends Keep Secrets, under exclusive license to Interscope Records",2025-03-21T04:00:07Z,UCjK8ORC71kwyj1DWFwril_A,SelenaGomezVEVO,10,"['Selena Gomez', 'benny blanco', 'SMG Music LLC Friends Keep Secrets under exclusive license to Interscope Records', 'Pop', 'young', 'hotter', 'than', 'new music', '2025', 'selena benny', 'call me break up', 'said love you first', 'someone else', 'used to come down for me']",PT3M19S,hd,true,2032345,154119,0,0,7685
j-RpvIuazmc,"Stromae, Pomme - “Ma Meilleure Ennemie” (from Arcane Season 2) [Official Music Video]","Stream “Ma Meilleure Ennemie” from the Arcane Season 2 Original Soundtrack: https://arcane.lnk.to/mameilleureennemie

Stream the full Arcane Season 2 Soundtrack: https://arcane.lnk.to/season2

Watch all episodes of Arcane now, only on Netflix: https://www.netflix.com/title/81435684

Shop official Arcane merchandise from Riot Games: https://riot.com/3FxDn3p

Follow #Arcane on social:
https://www.x.com/arcaneshow
https://www.instagram.com/arcaneshow/
https://www.facebook.com/arcaneshow/

Stromae 
Instagram: https://www.instagram.com/stromae/
TikTok: https://www.tiktok.com/@stromae
Twitter: https://x.com/stromae
Facebook: https://www.facebook.com/stromae/

Pomme
Instagram: https://www.instagram.com/pommeofficial/
TikTok: https://www.tiktok.com/@tamere_enstringdeguerre
Twitter: https://x.com/pommeofficial
Facebook: https://www.facebook.com/pommeofficial

LYRICS
Je t’aime, je te hais, je t’aime, je te hais
Je t’aime, je te hais, je t’aime, je te hais
Je t’aime, je te hais, je t’aime, je te hais
Je t’aime, je te hais, je t’aime, je te hais
T’es la meilleure chose qui m’est arrivée
Mais aussi la pire chose qui m’est arrivée
Ce jour où je t’ai rencontrée, j’aurais peut-être préféré
Que ce jour ne soit jamais arrivé
La pire des bénédictions
La plus belle des malédictions
De toi j’devrais m’éloigner
Mais comme dit le dicton
Plutôt qu’être seul mieux vaut être mal accompagné
Tu sais c’qu’on dit
Sois près d’tes amis les plus chers
Mais aussi
Encore plus près de tes adversaires
Mais ma meilleure ennemie c’est toi
Fuis-moi, le pire c’est toi et moi
mais si tu cherches encore ma voix,
oublie-moi, le pire c’est toi et moi,

pourquoi ton prénom me blesse,
quand il se cache,
juste là dans l’espace
c’est quelle émotion la haine,
ou la douceur quand j’entends ton prénom,
je te le dis, ne regarde pas en arrière
le passé qui te suit, me fait la guerre
Mais ma meilleure ennemie c’est toi
Fuis-moi, le pire c’est toi et moi
Mais ma meilleure ennemie c’est toi
Fuis-moi, le pire c’est toi et moi
Je t’aime, je te hais, je t’aime, je te hais
Je t’aime, je te hais, je t’aime, je te hais
Je t’aime, je te hais, je t’aime, je te hais
Je t’aime, je te hais, je t’aime, je te hais
Je t’aime, je te hais, je t’aime, je te hais
Je t’aime, je te hais, je t’aime, je te hais
Je t’aime, je te hais, je t’aime, je te hais
Je t’aime, je te hais, je t’aime, je te hais

Written by Luc Van Haver, Pomme, Alex Seaver, Stromae        
Produced by Stromae, Luc Van Haver
Additional Production by Alex Seaver 
Mixed by Josh Gudwin        
Mastered by Joe LaPorta          
       
Pomme appears courtesy of Sois Sage Musique, under exclusive license to Virgin Music France/Universal Music France

“Ma Meilleure Ennemie” Official Music Video
Produced by: Fortiche 
Director: Tom Gouill
Creative Directors: Pascal Charrue, Arnaud Delord, Bart Maunoury
Executive Producer: Christine Ponzevera",2025-03-20T15:55:06Z,UC2t5bjwHdUX4vM2g8TRDq5g,League of Legends,10,"['Riot Games', 'Riot', 'League of Legends', 'League', 'LoL', 'MOBA', 'Music', 'gaming', 'stromae', 'pomme', 'french', 'arcane', 'netflix', 'soundtrack', 'animation', 'pop', 'global', 'jinx', 'ekko', 'fortiche', 'powder']",PT2M49S,hd,false,6329912,967655,0,0,31315
ECqGCH1TfLY,j-hope ‘MONA LISA’ Official MV,"j-hope ‘MONA LISA’
💽 Listen now: https://jhope.lnk.to/MONALISA

Credits:
Director: Yongseok Choi (Lumpens) 
Assistant Director: Ran Ro (Lumpens)

Production House: NEWYEAR
Executive Producer: Yeonjin Kim 
Producer: Seungwon Lee
Production Assistant: Wonsung Yoon, Minjun Lee, Taein Jung

Director of Photography: Hyunwoo Nam (MOTHER) 
Focus Puller: Eunki Kim
2nd AC: Youngseo Park 
DIT: Minju Yoo
3rd AC: Sangphil Kim

Jimmy Jib Operator: Kim Young Jung 
1st Asst.: Choi Jo Jun
2nd Asst.: Bae Eun Taek 
3rd Asst.: Hong Young Tak

Gaﬀer: Heo Jung Hwan
Lighting Crew: Jo Hoik, Kim Yoon Sik, Kim Taeyang, Son Su Won, Bae Geon Yeol, Ryou Sung Hoon

Production Design: Mu:E
Art Director: Park Jinsil & Kim Bona
Asst. Art Director: Kim Yesol, Kim Dongheui 
Art Team Manager: Heo Ilho
Art Team: Kim Yong, Jong Insun, Yoo Yonghyun, Kwon Dongjin

DI: LUCID COLOUR
Colorist: Wonseok Ko
DI Crew: Dain Kim, Suhyeon Bae, Boram Yeom, Hyewon Hong 
DI Producer: Onew Kim
Manager: Yujin Seo


BIGHIT MUSIC. Rights are reserved selectively in the video. Unauthorized reproduction is a violation of applicable laws. Manufactured by BIGHIT MUSIC, Seoul, Korea.


Connect with BTS:
https://ibighit.com/bts
http://x.com/BTS_bighit
http://x.com/BTS_twt
http://www.facebook.com/bangtan.official
https://www.youtube.com/user/BANGTANTV
http://instagram.com/BTS.bighitofficial
https://www.tiktok.com/@bts_official_bighit
https://weverse.onelink.me/qt3S/94808190
https://www.weibo.com/BTSbighit
http://btsblog.ibighit.com

#jhope #제이홉 #jhope_MONALISA",2025-03-21T03:59:08Z,UC3IZKseVpdzPSBaWxBxundA,HYBE LABELS,10,"['HYBE', 'HYBE LABELS', '하이브', '하이브레이블즈', '제이홉 모나리자', 'jhope', 'jhope monalisa', 'jhope mona lisa']",PT2M45S,hd,true,4220330,892845,0,0,85639
OPK14FrnjO0,Jack Harlow - Just Us feat. Doja Cat,"Jack Harlow - Just Us feat. Doja Cat
Stream/Download: https://jackharlow.lnk.to/JustUs

Director: Neal Farmer @neal_farmstrong
EP: Sam Canter @samcanter
Producer: Jami Taylor Arceo @jamiarceoo 
DP: Emerson Duggan @embo920
Production Designer: Eric Finn Hersey @three60s
1st AD: Jonas Morales @makingmovesmorales
Location Manager: Derek Tramont @_selfiecity
Hair: Rachel Lita @rachellitahair
Makeup: Marlaine Reiner @mjr_makeup
Intimacy Coordinator: Maria Hintog
Editor: Neal Farmer @neal_farmstrong
Colorist: Aubrey Woodiwiss @aubreycolor
JH Stylist: Junichi Kamata @justjunch
DC Stylist: Brett Nelson @brettalannelson
Creative Direction: After The Studio @kathrynkenealy @olivia.haesuh @hotgirl_in_yourarea @abbyemason

Special thanks to Horses LA and Kacper Abolik!

JH Management - Range Media Partners 
Chris Thomas @thomchristmas
Drew Thomas @werdthomas 

DC Management - Good Day
Gordan Dillard @g_theonly1
Josh Kaplan @jkappy34
Makena Wasserman @makenawasserman
Whitney Jones @doubleujones

Label - Atlantic Records
Marketing: Angelique Jones @angie_4, Marsha St. Hubert @sthuby
Video: Kareem Johnson @kxreemjxhnsxn
Operations: Lily Thrall @lilamander

Label - Generation Now
Lake Morrison @lakesheezy
DJ Drama @djdrama
Don Cannon @doncannon

Lyrics:
I wish it was just in this bitch 
But they can’t trust us in this bitch
Cus I’m trying to buss nuts in this huh 
Let’s keep it on the hush hush in this bitch 
I told her she so pretty
And she just blushed in this bitch 
She clutch clutching my huh
I’m adjusting my huh
She husky like mush mush in this bitch 
You must be nuts rushin this 
Slow it down like macaroni 
I know it sound like Zack and Cody
This life’s sweet 
I mean highkey, and you might be
Something that isn’t quite but slightly… resembles wifey
Ima need this nightly
You say you know all about pisces 
I disagree but call it out nicely 
I’m all on you falling out my seat 
I wish it was just in this bitch 
But they can’t trust us in this bitch
Cus I’m trying to buss nuts in this huh 
Let’s keep it on the hush hush in this bitch 
I told her she so pretty
And she just blushed in this bitch 
She clutch clutching my huh
I’m adjusting my huh
She husky like mush mush in this bitch 
You must be nuts rushin this 
Slow it down like macaroni 
I know it sound like Zack and Cody
This life’s sweet 
I mean highkey
Two hands in my fro 
Staring into my soul
Leg up on that chair 
Hand on that arm 
Tongue in that throat 
I don’t play with my pen 
Leave it on a good note 
Keep you all on yo toes 
Leave the tv off for this show 
You a softy 
Marshmallows and black coffee
My mouth cold from this blue frosty 
My back blown cuz you blew it off me 
Like huh
You want me or what? 
Prove that with yo huh?
Spend sum for this huh?
Who said that ain’t love 
And this bass hittin real backhanded
Insatiable I’m like pac man 
we go back further than backgammon 
Hey Jackman I mean jackrabbit 
I’m running while I look back at it 
fans really some fanatics 
They cooked kinda like crack addicts 
We cookin shit up like black magic 
backs to ‘em 
Paper talk
Spoke fax to em 
Makeup on for these pop features 
Im throwing ass to some bad music 
Yea I’m that stupid like “duh”
You mad cute I wan’ fuck 
Don’t ice box me let’s touch 
I wish it was just in this bitch (bitch)
But they can’t trust us in this bitch (bitch)
Cus I’m trying to buss nuts in this huh (huh)
Let’s keep it (yeah) on a hush hush in this bitch (in this bitch)
I told her she so pretty (pretty pretty) 
And she just blushed in this bitch (in this bitch)
She clutch clutching my huh (breath)
I’m adjusting my huh (breath)
She husky like mush mush in this bitch 
You must be nuts rushin this (yeah)
We can just be friends like Musiq Soulchild 
And Bobby Valentino, you can slow it down 
We got all these Temptations like the group from Motown 
And I’m playa like the crew that came up through my hometown 

FOLLOW JACK HARLOW
Website: https://www.jackharlow.us/
Instagram: https://JackHarlow.lnk.to/Instagram
Twitter: https://JackHarlow.lnk.to/Twitter
Facebook: https://JackHarlow.lnk.to/Facebook

LISTEN TO JACK HARLOW
Youtube: https://JackHarlow.lnk.to/YouTube
SoundCloud: https://JackHarlow.lnk.to/SoundCloud
Spotify: https://JackHarlow.lnk.to/Spotify
Apple: https://JackHarlow.lnk.to/Apple

The official YouTube channel of Generation Now and Atlantic Records artist Jack Harlow. Subscribe for the latest music videos, performances, and more.

SUBSCRIBE TO JACK’S YOUTUBE: 
https://JackHarlow.lnk.to/YouTube

CLICK HERE FOR DOJA CAT UPDATES:
https://dojacat.lnk.to/connect

#JackHarlow",2025-03-21T04:00:07Z,UC6vZl7Qj7JglLDmN_7Or-ZQ,Jack Harlow,10,"['jack', 'harlow', 'jack harlow', 'doja', 'cat', 'doja cat', 'i wish it was just us', 'just us', 'jackman', 'rap', 'hip hop', 'huh', 'joseph quinn', 'boyfriend', 'dating', 'amala', 'dlamini', 'Jack Harlow', 'Doja Cat', 'Matt Damon', 'John Mayer', 'Nicholas Braun', 'PinkPantheress', 'Aksel Arvid', 'Ben Willett', 'Molly Baz', 'Malcolm Todd', 'Urban Wyatt', 'Nemo Achida', 'Lake Morrison', 'DJ Drama', 'Taylor Rooks', 'Mallory Edens', 'Cousin Greg', 'Succession', 'Generation Now']",PT2M56S,hd,false,1816264,135733,0,0,6987
PVnMjIYiFGc,Canada vs. Mexico: Extended Highlights | CONCACAF Nations League Semi-Final | CBS Sports Golazo,"Mexico and Canada face off in the second semi-final of the CONCACAF Nations League with a spot in the final up for grabs in Los Angeles.

#CONCACAF #NationsLeague #Canada #mexico  

CBS Sports brings you a channel dedicated to all things soccer in America. This account will be dedicated to providing social coverage of the USMNT as well as MLS, USL, its clubs/players and American players overseas.

Follow us across our social media! 
○ TWITTER: https://twitter.com/golazo_america
○ FACEBOOK: https://www.facebook.com/CBSSportsGolazoAmerica/
○ INSTAGRAM: https://www.instagram.com/golazoamerica/
○ TIK TOK: https://www.tiktok.com/@golazoamerica

Subscribe to our other CBS Sports Golazo channels!
https://www.youtube.com/@cbssportsgolazo
https://www.youtube.com/@CBSSportsGolazoEurope
https://www.youtube.com/@attackingthird



Visit the betting arena on CBS Sports.com: https://www.cbssports.com/betting/
For all the latest in sportsbook reviews: https://www.cbssports.com/betting/sportsbooks/
And sportsbook promos: https://www.cbssports.com/betting/promos/
For betting on soccer : https://www.cbssports.com/betting/soccer/",2025-03-21T04:55:18Z,UCh4tni-ICN9z0eMIPcf2r2g,CBS Sports Golazo America,24,"['USMNT', 'US Soccer', 'Soccer', ""United States Men's National Team"", 'USA Soccer', 'U.S. Soccer', 'MLS soccer', 'Jimmy Conrad', 'Charlie Davies', 'Heath Pearce', 'ussf', 'Call It What You Want', 'Tony Meola', ""US Men's National Team"", 'USA', 'MLS', 'Major League Soccer', 'Messi MLS']",PT13M23S,hd,false,432568,5130,0,0,906
NYH3pAYRrBM,Selena Gomez and benny blanco Burn With Love While Eating Spicy Wings | Hot Ones,"Selena Gomez and Benny Blanco are both pop-culture icons in their own right, and they have a brand-new collaborative album—""I Said I Love You First""—coming March 21st. Check out the singles ""Scared of Loving You,"" and ""Call Me When You Break Up"" featuring Gracie Abrams. But how are they with spicy food? Find out as the couple take on the wings of death together and discuss food hot takes, old-soul chats with Steve Martin and Martin Short, and their burning love for one another. Couples goals, Hot Ones style!


SUBSCRIBE TO FIRST WE FEAST ON YOUTUBE: http://goo.gl/UxFzhK

WATCH MORE EPISODES OF HOT ONES: https://fwfea.st/hof

BUY HOT ONES HOT SAUCE NOW: https://fwfea.st/hotsauces

SIGN UP FOR THE HOT ONES MONTHLY HOT SAUCE SUBSCRIPTION: https://bit.ly/2veY50P

TRY HOT ONES SPICY RAMEN: https://fwfea.st/ramen

TRY HOT ONES SPICY SNACK MIXES: https://fwfea.st/snackmixes

BUY HOT ONES TRUTH OR DAB: THE GAME: http://wildertoys.com

SIGN UP FOR THE FIRST WE FEAST NEWSLETTER: http://firstwefeast.com/signup


http://firstwefeast.com/
insta: firstwefeast
insta: hotones
x: firstwefeast
fb: firstwefeast",2025-03-20T15:00:33Z,UCPD_bxCRGpmmeQcbe2kpPaA,First We Feast,24,"['selena gomez', 'benny blanco', 'selena gomez hot ones', 'hot ones', 'sean evans', 'selena', 'gomez', 'First we feast', 'fwf', 'firstwefeast', 'food', 'food porn', 'cook', 'cooking', 'chef', 'recipe', 'spicy food', 'foodie', 'burgers', 'food documentary', 'sunset blvd', 'only murders in the building', 'hulu', 'martin short', 'steve martin', 'wizards', 'I Said I Love You First', 'Call Me When You Break Up', 'Younger And Hotter Than Me']",PT20M26S,hd,false,2907791,130349,0,0,10504
OA3KsYPhZbw,Cazzu - CON OTRA (Official Video),"Cazzu - CON OTRA (Official Video)

Escuchá CON OTRA acá https://orcd.co/conotra-cazzu

Redes Sociales: 
https://www.instagram.com/cazzu/
https://twitter.com/cazzuoficial
https://www.facebook.com/Cazzuuuuuu
https://vm.tiktok.com/ZML3jyC1d/",2025-03-20T00:00:07Z,UCM8F3UFEs95v8nil07Qd80Q,CAZZU Canal Oficial,10,"['cazzu', 'nena trampa', 'nena trampa cazzu', 'album cazzu nena trampa', 'cazzu nena trampa', 'album nena trampa', 'cazzu album 2022', 'argentina nena trampa', 'cazzu argentina', 'nena trampa cazzu video', 'cazzu video album nena trampa', 'nena trampa 2022', '2022 nena trampa', 'CON OTRA', 'DOLCE', 'LA CUEVA']",PT4M11S,hd,true,10634592,1015969,0,0,70464
4Dr5PPhgoas,BRASIL vs. COLOMBIA [2-1] | RESUMEN | ELIMINATORIAS SUDAMERICANAS | FECHA 13,"Vitória de quem acreditou até o último minuto! 🏆🇧🇷

¡Triunfo en el último minuto! 🙌⚽

El pentacampeón mundial derrotó 2-1 en Brasilia a una dura Colombia con un gol de Vinicius Jr en el descuento.
 
El inicio de Brasil fue enérgico, vertical e imprevisible, con Vinícius más cerca de la posición de 9 y Raphinha fluctuando con libertad.

Raphinha adelantó a los brasileños a los 6′, de penal, pero Luis Díaz dejó todo igual antes que finalice la primera etapa, con su gol a los 41′.

Brasil solo reaccionó tras el descanso. Vinícius probó a Vargas con un chut centrado. El arquero de 36 años volvió a ser fundamental ante las tentativas de Raphinha y Vinícius.

Ambos equipos buscaron con ahínco la victoria y, al final, fue Vinícius el que apareció en el último suspiro (99′), dándole la victoria a su selección.



#EliminatoriasSudamericanas 

#Brasil #Colombia 

Suscríbete I Inscreva-se I Subscribe: http://bit.ly/CONMEBOL
Facebook: facebook.com/CONMEBOL
Instagram: instagram.com/conmebol/
X: x.com/CONMEBOL",2025-03-21T03:50:48Z,UCzU8-lZlRfkV3nj0RzAZdrQ,CONMEBOL,17,"['fútbol', 'pelota', 'gol', 'copa', 'libertadores', 'sudamericana', 'eliminatorias', 'mundial', 'conmebol', 'cree en grande', 'alejandro domínguez', 'sudamerica', 'fútbol sudamericano', 'futebol', 'soccer', 'football', 'torneos sudamericanos', 'evolución', 'conmebol evolución', 'brasil 2x1', 'brasil vs colombia', 'colombia', 'brasil 2-1', 'brasil 2-1 colombia', 'brasil eliminatorias', 'colombia eliminatorias']",PT10M9S,hd,false,7536801,0,0,0,4680
07JmdlRkQmE,THE GASLIGHT DISTRICT [TRAILER],The Gaslight District is a gothic crime drama about a family of undead gangsters trying to find their place after the world has ended. PILOT EPISODE DROPS April 18th 2025.,2025-03-21T16:00:01Z,UCn_FAXem2-e3HQvmK-mOH4g,GLITCH,1,"['glitch', 'glitch productions', 'digital circus', 'the amazing digital circus', 'murder drones', 'Pomni', 'Uzi', 'Jax', 'Ragatha', 'Kinger', 'Gangle', 'Zooble', 'Caine', 'Bubble', '3D', 'Animation', '3D Animation', 'Indie Animation', 'Gummigoo']",PT1M16S,hd,true,1208729,161212,0,0,11263
bemMzsnVLuY,Christian Nodal - El Amigo (Video Oficial),"Christian Nodal - El Amigo | Video Oficial

Escúchala y guárdala en plataformas
› https://Nodal1.lnk.to/ElAmigo

Escucha los éxitos de Christian Nodal: https://SonyMexico.lnk.to/ChristianNodalPLExitos
Ve más videos de Christian Nodal: https://www.youtube.com/playlist?list=PL2cg72xd9U-hrEALNia_s_xzfysuNoiFX

Sigue a Christian Nodal en
› TikTok: https://www.tiktok.com/@nodal
› Instagram: https://www.instagram.com/nodal/
› Facebook: https://www.facebook.com/christiannodaloficialmx

Letra / Lyrics

De cora me alegra
Que ya tu vida no esté negra
Que le puso color y están mucho mejor
Se te nota y me cuentan

No es secreto que tú merecías más
De lo que te di, él fue el que ganó
Yo fui el que perdí
Y me frustra
Hablar de eso no me gusta

Yo de ese tema no opino
Pero ya con los tragos les digo
Que la trata como a una reina
Pero ella lo trata como amigo

Y él se ve fino
De esos que se emborrachan con vino
Pero yo que la conozco a ella
No le gusta, no es su estilo

Y la verdad
Juntos no se ven tan mal
Pero se veía mejor conmigo

(Uh)

El amigo es el titular
No yo, puede que le pese
Puede que la bese
Pero no la besa como yo la besé

A veces pienso que ella piensa en eso
A veces dice que es feliz, pero no parece
Con él ella no se humedece
Conmigo es que ella pertenece

Yo le doy un par de meses
Pa’ que conmigo regrese
Ni aunque ore, ni aunque rece
Ni aunque es mucho lo que ofrece
Ella con él no envejece

No sabe dónde quedan esos puntos
Que la vuelven loca
Él le toca el cuerpo
Pero soy yo el que al alma le toca

Les pido de compas
Que no me hagan abrir la boca
Que yo de ese tema no opino

Pero ya con los tragos les digo
Que la trata como a una reina
Pero ella lo trata como amigo

Y él se ve fino
De esos que se emborrachan con vino
Pero yo que la conozco a ella
No le gusta, no es su estilo

Y la verdad
Juntos no se ven tan mal
Pero se veía mejor conmigo

#ChristianNodal #ElAmigo

(C) 2025 Sony Music Entertainment México, S.A. de C.V. Bajo Distribución en Exclusiva de Christian Nodal",2025-03-21T00:00:07Z,UC8BcjeZ5Iz5hgmb_QgLRapQ,ChristianNodalVEVO,10,"['latin', 'latin music', 'musica en español', 'mexico', 'video', 'video oficial', 'video con letra', 'lyric', 'lyrics video', 'video letra', 'letra de la canción', 'el amigo', 'christian nodal', 'nodal', 'christian nodal el amigo', 'banda', 'regional mexicano', 'musica mexicana', 'mariachi', 'el amigo nodal', 'el amigo christian nodal', 'pop mexicano', 'Emotional', 'Heartbreak', 'Latin Pop', 'Loving', 'Mariacheño', 'Nostalgic', 'Nuevo Pop', 'Pop', 'Regional Mexican', 'Romantic', 'Sad', 'Sentimental']",PT3M24S,hd,true,1451500,56700,0,0,13172
r4VacqlblS4,Croatia vs. France UEFA Nations League Highlights | FOX Soccer,"Check out the top moments between Croatia and France in the UEFA Nations League.

#FOXSoccer #UEFA #France

SUBSCRIBE to get the latest FOX Soccer content: http://foxs.pt/SubscribeFOXSOCCER

The FOX Sports App, built for the modern sports fan: https://t.co/CRhWt4ryp3

About FOX Soccer:
With exclusive highlights, original programming, and behind the scenes footage, FOX Soccer’s YouTube channel provides the sports content that fans are hungry for. FOX Soccer presents: MLS, FIFA World Cup, FIFA Women’s World Cup, Copa America, Euros, Gold Cup and many more.

Croatia vs. France UEFA Nations League Highlights | FOX Soccer
https://youtu.be/r4VacqlblS4

FOX Soccer
https://www.youtube.com/user/Foxsoccer",2025-03-20T22:17:04Z,UCooTLkxcpnTNx6vfOovfBFA,FOX Soccer,17,"['soccer', 'uefa nations league', 'france', 'croatia', 'mbappe', 'highlights', 'sports highlights', 'soccer highlights', 'fox sports highlights', 'soccer on fox', 'fox', 'fox sports', 'fox sports 1', 'fs1', 'sports', 'sports talk', 'sports news', 'sports debate', 'soccer talk', 'soccer news', 'soccer debate', 'fox youtube', 'goals', 'penalties', 'European Soccer', 'Union of European Football Associations', 'Football', 'Futbol', '2025 Nations League']",PT10M7S,hd,false,499257,5179,0,0,806
kBUgRM0Lf2M,I'm A Little Crazy,"Provided to YouTube by Universal Music Group

I'm A Little Crazy · Morgan Wallen

I'm A Little Crazy

℗ 2025 Big Loud Records, under exclusive license to Mercury Records, a division of UMG Records, Inc.

Released on: 2025-03-21

Recording Second Engineer: Katelyn Prieboy
Recording Second Engineer: Joey Stanca
Soundeditor: Scott Cooke
Soundeditor: Matt McCartney
Soundeditor: Eivind Nordland
Soundeditor: Ryan Yount
Mixing Engineer: Joey Moi
Mastering Engineer: Ted Jensen
Vocalist: Morgan Wallen
Background Vocalist: HARDY
Production Manager: Ally Gecewicz
Composer Lyricist: Michael Hardy
Composer Lyricist: Smith Ahnquist
Composer Lyricist: Hunter Phelps
Composer Lyricist: Jameson Rodgers

Auto-generated by YouTube.",2025-03-20T10:01:03Z,UC5xaQ6_dP7EGDmGLzVGZ1Ow,Morgan Wallen - Topic,10,"['Morgan Wallen', ""I'm A Little Crazy""]",PT3M20S,hd,false,200179,10683,0,0,136
YO-L5bgUgPQ,Ho3ein X EpiCure - 33 (Official  Music Video),"HO3EIN x EPICURE - 33

DIRECTOR: ALI PAZANI x MEHDI AMIRI

BEAT PRODUCER: SAMAN BEATS

MIX & MASTERING: IMAN MIRAN

COVER ART & COMPOSITOR: POURIYA SADEGHI

VIDEO EDIT & COLORGRADING: ALI PAZANI

PRODUCTION MANAGER: ARMES NADALI

SPONSORE: KIFPOOL.ME & TEHRAN SPEAKER

CASTING:
ARMAN EPICURE
HOOTAN DAVARI
AMIR PARVIZI
IMAN EPICURE
SAEED SAEEDI
BOBBY SALAR
MARAL BIDARBAKHT
MOHAMMAD RAMEZANI POUR
IST KHODRO
ARIA HAFT
SHAHAB HOSSEINI
TURUNCU AUTO SERVICE
POURIYA ZARGAR
DANIAL SHIRI


#rap #ho3ein #epicure",2025-03-21T11:54:14Z,UCfXreRRZE33aUhRYOtzA96Q,OG EPIC (EpiCure),10,"['ho3ein', 'epicure', '33', 'rap', 'rapfa', 'farsi', 'music', 'iran', 'persian', 'hiphop', 'hosein', 'amir epicure', 'siose', 'feat', 'حصین', 'حسین', 'اپیکور', 'رپ', 'فارسی', 'رپفا', 'موزیک', 'پرشین', 'هیپ هاپ', 'امیر', '۳۳', 'حصین فیت اپیکور', 'سی و سه']",PT6M26S,hd,false,405397,17637,0,0,11082
