video_title,video_id,description,thumbnail,channel_title
3 Super Fun Free Offline Android Games! 🎮,uXgvOAk5fDU,These Android games are so much fun and the best part is that they are free! You're welcome BTW! Rally Horizon: ...,https://i.ytimg.com/vi/uXgvOAk5fDU/default.jpg,Beebom
3 Free Offline Android Games You’ve Gotta Try! 🎮,XchlBKzkIa4,"Everyone wants Android games that are free, work offline and are super fun to play. In this video, we show you 3 free offline ...",https://i.ytimg.com/vi/XchlBKzkIa4/default.jpg,Sillycorns
Top 10 New Games for Android of 2025 (Online/Offline) | High Graphics Android Games,g_iAydyDWzU,"Hey guys, I will show you the ""Top 10 New Games for Android of 2025"" in this video. So many of you were asking for new games ...",https://i.ytimg.com/vi/g_iAydyDWzU/default.jpg,PROTECH
Top 10 REALISTIC OPEN WORLD Games For Android &amp; iOS 2025 | Best HIGH GRAPHICS Games For Android,hJafDH2UgGM,Top 10 REALISTIC OPEN WORLD Games For Android & iOS 2025 | Best HIGH GRAPHICS Games For Android THANKS FOR ...,https://i.ytimg.com/vi/hJafDH2UgGM/default.jpg,Gaming Shower
Top 5 Offline Android Games #shorts #offlinegames #2024 #limbo,6JxkhkbjDIU,LIMBO demo -- https://play.google.com/store/apps/details?id=com.playdead.limbo Monument Valley 2 ...,https://i.ytimg.com/vi/6JxkhkbjDIU/default.jpg,ZaneX
Indian bike 3d game 😄 new Thar and Porsche all Lamborghini and bike ZX10r the KTM and R15,QF3sZ8sR4jc,,https://i.ytimg.com/vi/QF3sZ8sR4jc/default.jpg,AK GAMRZ
3 Super Fun Free Offline Android Games! 🎮,vpAtBSOFkjk,These 3 Android games are so much fun and the best part is that they are free! You're welcome BTW! Spider Fighting Hero: ...,https://i.ytimg.com/vi/vpAtBSOFkjk/default.jpg,Beebom
best offline games for android - best offline game in play store #offlinegames,KkgysbgUe80,best offline games for android - best offline game in play store #offlinegames #shorts best offline games for android offline games ...,https://i.ytimg.com/vi/KkgysbgUe80/default.jpg,Gaming review Top
best offline games for android - best game #shorts #games #offlinegames,nZJlP6K6m-g,best offline games for android - best game #shorts #games #offlinegames games best offline games for android best game best ...,https://i.ytimg.com/vi/nZJlP6K6m-g/default.jpg,Gaming review Top
Top 3 high graphics games for android #shorts  #game,9OXZQDlGslo,shorts #youtubeshorts #viral #funny #gaming #game #gamer #mobilegame.,https://i.ytimg.com/vi/9OXZQDlGslo/default.jpg,Orevo shorts
